{
  "$schema": "https://json-schema.org/draft/2020-12/schema",
  "$id": "https://taku.ai/schemas/subapp-runtime-manifest.v1.schema.json",
  "title": "Existing Taku SubApp Runtime Manifest",
  "description": "Runtime-only contract for taku.manifest.json. The file itself intentionally has no schemaVersion field.",
  "type": "object",
  "additionalProperties": false,
  "required": [
    "name"
  ],
  "properties": {
    "name": {
      "type": "string",
      "minLength": 1
    },
    "description": {
      "type": "string"
    },
    "version": {
      "type": "string",
      "minLength": 1
    },
    "iconPath": {
      "$ref": "#/$defs/relativePath"
    },
    "actions": {
      "type": "array",
      "items": {
        "$ref": "#/$defs/action"
      }
    },
    "llm": {
      "type": "object",
      "additionalProperties": false,
      "properties": {
        "required": {
          "type": "boolean"
        },
        "preferLocal": {
          "type": "boolean"
        },
        "fallback": {
          "enum": [
            "cloud",
            "none"
          ]
        }
      }
    },
    "runtimeCapabilities": {
      "type": "object",
      "additionalProperties": false,
      "required": [
        "protocol",
        "operations"
      ],
      "properties": {
        "protocol": {
          "const": "taku.agent.run/v2"
        },
        "operations": {
          "type": "array",
          "maxItems": 64,
          "uniqueItems": true,
          "items": {
            "type": "object",
            "additionalProperties": false,
            "required": [
              "id",
              "revision"
            ],
            "properties": {
              "id": {
                "type": "string",
                "maxLength": 128,
                "pattern": "^[a-z][a-zA-Z0-9]*(?:\\.[a-z][a-zA-Z0-9]*)+$"
              },
              "revision": {
                "type": "integer",
                "minimum": 1,
                "maximum": 9007199254740991
              }
            }
          }
        }
      }
    }
  },
  "$defs": {
    "relativePath": {
      "type": "string",
      "minLength": 1,
      "pattern": "^(?!/)(?![A-Za-z]:[\\\\/])(?!.*(?:^|/)\\.\\.(?:/|$))[^\\u0000]+$"
    },
    "action": {
      "type": "object",
      "additionalProperties": false,
      "required": [
        "name"
      ],
      "properties": {
        "name": {
          "type": "string",
          "pattern": "^[A-Za-z][A-Za-z0-9._-]{0,127}$"
        },
        "description": {
          "type": "string"
        },
        "runtime": {
          "enum": [
            "server_http",
            "client_postmessage"
          ]
        },
        "params": {
          "type": "object",
          "propertyNames": {
            "pattern": "^[A-Za-z][A-Za-z0-9_-]{0,127}$"
          },
          "additionalProperties": {
            "$ref": "#/$defs/param"
          }
        },
        "returns": {
          "type": "object",
          "additionalProperties": false,
          "properties": {
            "type": {
              "type": "string",
              "minLength": 1
            },
            "description": {
              "type": "string"
            }
          }
        },
        "execution": {
          "type": "object",
          "additionalProperties": false,
          "properties": {
            "defaultMode": {
              "enum": [
                "sync",
                "async"
              ]
            },
            "timeoutMs": {
              "type": "integer",
              "minimum": 1
            }
          }
        },
        "isUserVisible": {
          "type": "boolean"
        }
      }
    },
    "param": {
      "type": "object",
      "additionalProperties": false,
      "required": [
        "type"
      ],
      "properties": {
        "type": {
          "enum": [
            "string",
            "number",
            "boolean",
            "object",
            "array",
            "filePath",
            "directoryPath"
          ]
        },
        "description": {
          "type": "string"
        },
        "required": {
          "type": "boolean"
        },
        "default": true,
        "enum": {
          "type": "array"
        },
        "format": {
          "type": "string",
          "minLength": 1
        },
        "ui": {
          "type": "object",
          "additionalProperties": false,
          "properties": {
            "label": {
              "type": "string",
              "minLength": 1
            },
            "placeholder": {
              "type": "string"
            },
            "widget": {
              "enum": [
                "text",
                "textarea",
                "select",
                "number",
                "switch",
                "filePicker",
                "pathPicker"
              ]
            }
          }
        }
      }
    }
  }
}
