{
  "name": "takuai-template",
  "description": "TakuAI 应用模板 - 示例 Taku App",
  "version": "0.3.3",
  "actions": [
    {
      "name": "greet",
      "description": "打个招呼",
      "params": {
        "name": {
          "type": "string",
          "required": false,
          "description": "要问候的名字",
          "default": "World"
        }
      }
    },
    {
      "name": "getStatus",
      "description": "获取应用状态",
      "returns": {
        "type": "object",
        "description": "包含应用运行状态的对象"
      }
    }
  ]
}
